{
  "format": "city-plan/0.1",
  "name": "plan-b2-pavilions",
  "description": "Plan-b1 plus a one-story fully-skylit 60x60 pavilion centered in each courtyard, top at the 45-degree sight line so it blocks no daylight. Planted roof.",
  "units": "feet",
  "tile": { "width": 134, "depth": 134 },
  "solids": [
    {
      "id": "waffle-bands",
      "derivation": "134^2 - 84^2",
      "count_per_tile": 1,
      "footprint_sf": 10900,
      "base_floor": 1,
      "stories": 7,
      "light_fractions": { "windowed": 1.0 },
      "circulation_fraction": 0.0,
      "internal_circulation_fraction": 0.1442,
      "internal_circulation_derivation": "double-loaded 6-ft corridor along both band centerlines, crossing once at the intersection: 6 x 134 x 2 - 36 = 1,572 sf of 10,900 = 14.4%. Vertical circulation is not charged: gens 1-3 are massing studies that never specified how floors are reached (the no-stairs premise rules out stair cores; the ramp galleries arrive in gen 4)."
    },
    {
      "id": "court-pavilion",
      "derivation": "60x60, 12-ft moat on all sides",
      "count_per_tile": 1,
      "footprint_sf": 3600,
      "base_floor": 1,
      "stories": 1,
      "light_fractions": { "skylit": 1.0 },
      "circulation_fraction": 0.0,
      "internal_circulation_fraction": 0.10,
      "internal_circulation_derivation": "one 6-ft corridor across the 60-ft pavilion: 360 sf of 3,600 = 10%; entered at grade from the moat",
      "roof": "garden (sole light source below - unbuildable)"
    }
  ],
  "circulation_graph": [],
  "expected_results": {
    "assumptions": "platonic-default",
    "saleable_far": 4.45, "ground_coverage": 0.81,
    "gross_value_per_sf_land": 13249, "cost_per_sf_land": 6999,
    "net_value_per_sf_land": 6250
  }
}
