{
  "format": "city-plan/0.1",
  "name": "plan-b3-traditional-streets",
  "description": "Counterfactual: Plan 3 massing but 30% of land surrendered to roads and parking. Tile is one module of buildable land plus its share of right-of-way.",
  "units": "feet",
  "tile": { "area_sf": 25651.43, "note": "134x134 / 0.70 buildable fraction" },
  "solids": [
    {
      "id": "waffle-bands",
      "count_per_tile": 1,
      "footprint_sf": 10900,
      "base_floor": 1,
      "stories": 7,
      "light_fractions": { "windowed": 1.0 },
      "circulation_fraction": 0.0
    },
    {
      "id": "court-pavilion",
      "count_per_tile": 1,
      "footprint_sf": 3600,
      "base_floor": 1,
      "stories": 1,
      "light_fractions": { "skylit": 1.0 },
      "circulation_fraction": 0.0
    },
    {
      "id": "penthouse-lattice",
      "count_per_tile": 1,
      "footprint_sf": 6292,
      "base_floor": 8,
      "stories": 1,
      "light_fractions": { "windowed": 1.0 },
      "circulation_fraction": 0.0
    }
  ],
  "circulation_graph": [
    { "type": "street", "level": 0, "right_of_way_fraction": 0.30, "note": "cars, buses, parking" }
  ],
  "expected_results": {
    "assumptions": "platonic-default",
    "saleable_far": 3.36, "ground_coverage": 0.57,
    "gross_value_per_sf_land": 10010, "cost_per_sf_land": 5488,
    "net_value_per_sf_land": 4522
  }
}
