{
  "format": "city-plan/0.1",
  "name": "plan-b3-penthouses",
  "description": "Plan-b2 plus an 8th-floor penthouse lattice, 26 ft wide on band centerlines, 12-ft setbacks under the continued 45-degree planes, flanked by roof terraces.",
  "units": "feet",
  "tile": { "width": 134, "depth": 134 },
  "solids": [
    {
      "id": "waffle-bands",
      "derivation": "134^2 - 84^2",
      "count_per_tile": 1,
      "footprint_sf": 10900,
      "base_floor": 1,
      "stories": 7,
      "light_fractions": { "windowed": 1.0 },
      "circulation_fraction": 0.0,
      "internal_circulation_fraction": 0.1442,
      "internal_circulation_derivation": "double-loaded 6-ft corridor along both band centerlines, crossing once at the intersection: 6 x 134 x 2 - 36 = 1,572 sf of 10,900 = 14.4%. Vertical circulation is not charged: gens 1-3 are massing studies that never specified how floors are reached (the no-stairs premise rules out stair cores; the ramp galleries arrive in gen 4)."
    },
    {
      "id": "court-pavilion",
      "count_per_tile": 1,
      "footprint_sf": 3600,
      "base_floor": 1,
      "stories": 1,
      "light_fractions": { "skylit": 1.0 },
      "circulation_fraction": 0.0,
      "internal_circulation_fraction": 0.10,
      "internal_circulation_derivation": "one 6-ft corridor across the 60-ft pavilion: 360 sf of 3,600 = 10%; entered at grade from the moat"
    },
    {
      "id": "penthouse-lattice",
      "derivation": "26-ft band centered on 50-ft band: 134^2 - 108^2 = 6,292 sf",
      "count_per_tile": 1,
      "footprint_sf": 6292,
      "base_floor": 8,
      "stories": 1,
      "light_fractions": { "windowed": 1.0 },
      "circulation_fraction": 0.0,
      "internal_circulation_fraction": 0.0,
      "internal_circulation_derivation": "26-ft band flanked by 12-ft roof terraces on both sides; rooms open directly onto the terraces, which serve as the access walkway, so no corridor inside the floorplate",
      "roof": "terraces flank; 2nd tier geometrically impossible"
    }
  ],
  "circulation_graph": [],
  "expected_results": {
    "assumptions": "platonic-default",
    "saleable_far": 4.80, "ground_coverage": 0.81,
    "gross_value_per_sf_land": 14300, "cost_per_sf_land": 7840,
    "net_value_per_sf_land": 6460
  }
}
